{
  "id": "qa.algebra.linear-equations",
  "microTopicId": "qa.algebra.linear-equations",
  "bodyMarkdown": "## Before you start\n\nComfort rearranging an equation, and turning a sentence into symbols.\n\n## The idea in plain language\n\nA balance scale with the same weight on both pans stays level. Add 3 kg to one side and you must add 3 kg to the other, or it tips. An equation is that scale, and the equals sign is the pivot.\n\nSolving means peeling away everything around the unknown, doing the identical thing to both sides each time, until the unknown sits alone.\n\n## What is actually going on\n\nOne equation with one unknown pins it down. One equation with **two** unknowns does not \u2014 $x + y = 10$ has endless solutions. You need as many independent equations as unknowns.\n\nTo solve a pair, get rid of one variable. **Elimination** scales the two equations so one variable has matching coefficients, then subtracts. **Substitution** rearranges one equation and plugs it into the other. Both work; elimination is usually faster when coefficients are tidy.\n\n## Every question type you will meet\n\nEach of these is a shape a question in this topic actually comes in. Learn to recognise the shape first \u2014 in a timed paper, picking the right method is most of the battle, and the arithmetic is the easy part.\n\n### 1. Two equations in two unknowns\n\n**Spot it when:** two separate facts about two unknown quantities.\n\n1. Line the equations up with the variables in the same order.\n2. Eliminate one variable by adding or subtracting suitable multiples, or substitute one equation into the other.\n3. Solve for the survivor, then back-substitute for the other.\n\n**Worked through:** $2x + 3y = 23$ and $x - y = 4$ give $x = y + 4$, so $2(y+4) + 3y = 23$, hence $5y = 15$, $y = 3$ and $x = 7$.\n\n### 2. Sum and difference\n\n**Spot it when:** 'the sum of two numbers is 40 and their difference is 8'.\n\n1. Add the two facts to get twice the larger; halve it.\n2. Subtract them to get twice the smaller; halve that.\n3. This is faster than full elimination and worth recognising on sight.\n\n**Worked through:** Sum 40, difference 8 give $\\dfrac{48}{2} = 24$ and $\\dfrac{32}{2} = 16$.\n\n### 3. Coins, tickets and mixed-item word problems\n\n**Spot it when:** a count of items and a total value, with items of differing worth.\n\n1. Write one equation for the number of items and one for the total value.\n2. The value equation multiplies each count by its denomination.\n3. Solve the pair as usual.\n\n**Worked through:** 30 coins of Rs. 1 and Rs. 5 worth Rs. 78 give $x + y = 30$ and $x + 5y = 78$, so $y = 12$.\n\n## Check yourself\n\nYou are ready to start practising this topic when you can:\n\n- Solve a two-variable system by both elimination and substitution.\n- Spot a sum-and-difference pair and answer it in one line.\n- Turn a worded count-and-value situation into two equations.",
  "workedExamples": [
    {
      "id": "qa.algebra.linear-equations.ex1",
      "stemMarkdown": "Solve $2x + 3y = 16$ and $3x - y = 2$.",
      "solutionMarkdown": "The second equation gives $y = 3x - 2$. Substitute into the first:\n\n$2x + 3(3x - 2) = 16$, so $2x + 9x - 6 = 16$, giving $11x = 22$ and $x = 2$.\n\nThen $y = 3(2) - 2 = 4$.\n\nCheck: $2(2) + 3(4) = 16$ and $3(2) - 4 = 2$. Both hold.",
      "altSolutionMarkdown": "By elimination: multiply the second by 3 to get $9x - 3y = 6$, add to the first, and the $y$ terms cancel to give $11x = 22$."
    },
    {
      "id": "qa.algebra.linear-equations.ex2",
      "stemMarkdown": "A box has 20 coins of Rs. 5 and Rs. 10, worth Rs. 145 in total. How many Rs. 5 coins are there?",
      "solutionMarkdown": "Let $x$ be the number of Rs. 5 coins, so $20 - x$ are Rs. 10 coins.\n\n$5x + 10(20 - x) = 145$\n\n$5x + 200 - 10x = 145$, so $-5x = -55$ and $x = 11$.\n\nThere are 11 five-rupee coins and 9 ten-rupee coins. Check: $55 + 90 = 145$.",
      "altSolutionMarkdown": null
    }
  ],
  "formulaCards": [
    {
      "id": "qa.algebra.linear-equations.fc1",
      "microTopicId": "qa.algebra.linear-equations",
      "title": "Solving a 2 by 2 system",
      "bodyMarkdown": "For $a_1x + b_1y = c_1$ and $a_2x + b_2y = c_2$: $x = \\dfrac{c_1b_2 - c_2b_1}{a_1b_2 - a_2b_1}$.",
      "exampleMarkdown": "$2x + 3y = 16$, $3x - y = 2$ gives $x = \\dfrac{16(-1) - 2(3)}{2(-1) - 3(3)} = \\dfrac{-22}{-11} = 2$."
    },
    {
      "id": "qa.algebra.linear-equations.fc2",
      "microTopicId": "qa.algebra.linear-equations",
      "title": "When there is no unique solution",
      "bodyMarkdown": "If $a_1b_2 = a_2b_1$ the lines are parallel: either no solution, or infinitely many if the equations are multiples of each other.",
      "exampleMarkdown": "$2x + 4y = 6$ and $x + 2y = 3$ are the same line, so every point on it is a solution."
    }
  ],
  "commonTraps": [
    "Doing something to one side of the equation and forgetting the other.",
    "Sign errors when subtracting one equation from another. Write out the subtraction rather than doing it in your head.",
    "Not checking the answer back in both original equations. It takes ten seconds and catches most mistakes."
  ],
  "estReadMinutes": 6
}
