{
  "id": "dilr.lr.games-tournaments",
  "microTopicId": "dilr.lr.games-tournaments",
  "bodyMarkdown": "## Before you start\n\nBasic arithmetic, and comfort with a results table.\n\n## The idea in plain language\n\nA league table is just bookkeeping. Every match hands out a fixed number of points, and the table is the running total.\n\nThe useful consequence: the **total** points awarded across the whole tournament is fixed before a single game is played. That total is often the key that unlocks an incomplete table.\n\n## What is actually going on\n\nFirst establish the format. In a round robin with $n$ teams, each pair meets once, giving $\\binom{n}{2}$ matches. If a win is 2 points and there are no draws, the total handed out is $2 \\times \\binom{n}{2}$.\n\nThat total lets you find a missing team's points by subtraction, and caps how high any team can finish.\n\nFor 'maximum possible' questions, imagine the most favourable remaining results for the team in question \u2014 but check the arrangement is actually consistent, since one team winning means another must lose.\n\n## Every question type you will meet\n\nEach of these is a shape a question in this topic actually comes in. Learn to recognise the shape first \u2014 in a timed paper, picking the right method is most of the battle, and the arithmetic is the easy part.\n\n### 1. Round-robin bookkeeping\n\n**Spot it when:** every team plays every other team.\n\n1. With $n$ teams the total matches are $\\dfrac{n(n-1)}{2}$.\n2. Total points across the table are fixed by the scoring system, which is a strong check.\n3. Fill the results grid, remembering each match appears twice \u2014 once for each team.\n\n**Worked through:** Five teams play 10 matches; at 2 points a win and 1 each for a draw, the total is always 20.\n\n### 2. Knockout structure\n\n**Spot it when:** rounds, byes, eliminations.\n\n1. Each match eliminates exactly one team, so $n$ teams need $n - 1$ matches to produce a winner.\n2. Work backwards from the final to place teams in the bracket.\n\n**Worked through:** 16 teams need 15 matches in total, across 4 rounds.\n\n### 3. Best and worst case\n\n**Spot it when:** 'what is the minimum score guaranteeing qualification'.\n\n1. For a guarantee, assume everything goes against the team in question.\n2. For a possibility, assume everything goes in its favour.\n3. Keep the two questions separate \u2014 they have different answers and are easy to conflate.\n\n**Worked through:** A team may qualify with 6 points in the best case but need 8 to be certain.\n\n## Check yourself\n\nYou are ready to start practising this topic when you can:\n\n- Count matches and total points in a round robin.\n- Work a knockout bracket backwards.\n- Distinguish 'could qualify' from 'must qualify'.",
  "workedExamples": [
    {
      "id": "dilr.lr.games-tournaments.ex1",
      "stemMarkdown": "Four teams play a round robin, each pair once. How many matches are played?",
      "solutionMarkdown": "Every pair of teams meets exactly once, so count the pairs:\n\n$\\binom42 = \\dfrac{4 \\times 3}{2} = 6$ matches.",
      "altSolutionMarkdown": "Listing them confirms it: AB, AC, AD, BC, BD, CD."
    }
  ],
  "formulaCards": [
    {
      "id": "dilr.lr.games-tournaments.fc1",
      "microTopicId": "dilr.lr.games-tournaments",
      "title": "Round robin size",
      "bodyMarkdown": "$n$ teams playing each other once gives $\\binom{n}{2} = \\dfrac{n(n-1)}{2}$ matches. Twice each doubles it.",
      "exampleMarkdown": "6 teams play 15 matches in a single round robin."
    },
    {
      "id": "dilr.lr.games-tournaments.fc2",
      "microTopicId": "dilr.lr.games-tournaments",
      "title": "Total points",
      "bodyMarkdown": "With a fixed award per match, total points $=$ matches $\\times$ points per match. Use it to find a missing entry.",
      "exampleMarkdown": "6 matches at 2 points each distributes 12 points in total."
    }
  ],
  "commonTraps": [
    "Forgetting whether teams meet once or twice. It doubles everything.",
    "Ignoring draws when the format allows them, which changes the points-per-match total.",
    "Computing a 'maximum possible' score without checking the results are mutually consistent."
  ],
  "estReadMinutes": 7
}
