{
  "id": "dilr.di.stacked-charts",
  "microTopicId": "dilr.di.stacked-charts",
  "bodyMarkdown": "## Before you start\n\nBar charts, and shares of a total.\n\n## The idea in plain language\n\nA stacked bar is several bar charts balanced on top of each other. The whole column tells you the total; each coloured band tells you one component's contribution.\n\nThe catch is that only the bottom band starts at zero. Every band above it has to be read as a **difference** between two boundary lines, which is where careless reading costs marks.\n\n## What is actually going on\n\nTwo questions get asked. Absolute questions ask for one band's size \u2014 read the gap between its top and bottom edges. Proportional questions ask for a component's share of its column \u2014 divide the band by the column total.\n\nWatch for the difference between a component **growing** and its **share** growing. A component can increase in absolute terms while its share falls, if the total grew faster.\n\n## Every question type you will meet\n\nEach of these is a shape a question in this topic actually comes in. Learn to recognise the shape first \u2014 in a timed paper, picking the right method is most of the battle, and the arithmetic is the easy part.\n\n### 1. Reading a segment's value\n\n**Spot it when:** a bar divided into coloured bands.\n\n1. A segment's value is the **difference** between its two boundaries, not the height of its upper edge.\n2. Read both boundaries, then subtract.\n3. This is the single most common error in the topic.\n\n**Worked through:** A band running from 30 to 50 is worth 20, not 50.\n\n### 2. Totals per bar\n\n**Spot it when:** 'which year had the highest total'.\n\n1. The total is the full height of the bar, which is read directly.\n2. For a 100-percent stacked chart every bar is the same height, so totals must come from the text instead.\n\n**Worked through:** If every bar tops out at 100, the chart shows composition only, not size.\n\n### 3. Composition changes over time\n\n**Spot it when:** 'did X's share grow', across several stacked bars.\n\n1. Compute the segment's share of its own bar, for each bar.\n2. Compare the shares, not the raw segment sizes.\n3. A segment can grow in size while shrinking in share.\n\n**Worked through:** A segment going 20-of-80 to 25-of-125 grew in size but fell from 25 to 20 percent.\n\n## Check yourself\n\nYou are ready to start practising this topic when you can:\n\n- Get a segment's value by subtracting its boundaries.\n- Tell a 100-percent stacked chart from an absolute one.\n- Separate a change in size from a change in share.",
  "workedExamples": [
    {
      "id": "dilr.di.stacked-charts.ex1",
      "stemMarkdown": "Quarterly sales stack as Electronics 45, Apparel 30, Groceries 25 in Q1. What share of Q1 came from Electronics?",
      "solutionMarkdown": "Q1 total $= 45 + 30 + 25 = 100$.\n\nElectronics share $= \\dfrac{45}{100} \\times 100 = 45$ percent.",
      "altSolutionMarkdown": null
    }
  ],
  "formulaCards": [
    {
      "id": "dilr.di.stacked-charts.fc1",
      "microTopicId": "dilr.di.stacked-charts",
      "title": "Reading a band",
      "bodyMarkdown": "A band's value is (its top edge) minus (its bottom edge), not its top edge alone.",
      "exampleMarkdown": "A band running from 45 to 75 on the axis represents 30, not 75."
    },
    {
      "id": "dilr.di.stacked-charts.fc2",
      "microTopicId": "dilr.di.stacked-charts",
      "title": "Share within a column",
      "bodyMarkdown": "Component share $= \\dfrac{\\text{band}}{\\text{column total}} \\times 100$.",
      "exampleMarkdown": "A band of 30 in a column totalling 120 is a 25 percent share."
    }
  ],
  "commonTraps": [
    "Reading a band's top edge as its value instead of subtracting the bottom edge.",
    "Confusing growth in absolute size with growth in share.",
    "Comparing bands across columns of different heights without converting to shares."
  ],
  "estReadMinutes": 5
}
